{
  "id": "run-1",
  "next_attempt": 1,
  "kind": "dispatch",
  "started_at": "2026-10-23T00:00:00Z",
  "routes": [],
  "task_ids": [
    "task-1"
  ],
  "timeout_seconds": 3600.0,
  "status": "running",
  "owner_stdout": "/run/_owner/stdout.jsonl",
  "owner_stderr": "/run/_owner/stderr.log",
  "host_pid": 101,
  "host_started_at": "Fri Oct 23 00:00:00 2026"
}
